{
  "slug": "video-production",
  "name": "Video Production",
  "description": "5-skill video production toolkit: beat-synced reels from product images, AI-animated product reels via Higgsfield, talking head videos via HeyGen, long-form to short-form clip repurposing, and screen recording polish with zoom/pan effects.",
  "tags": [
    "content"
  ],
  "skills": [
    "beat-sync-reel",
    "product-reel-generator",
    "talking-head-video",
    "video-clipper",
    "video-polish"
  ],
  "shared_files": [
    "fonts/Cormorant-Italic.ttf",
    "fonts/Cormorant-Regular.ttf",
    "fonts/Montserrat-Bold.ttf",
    "fonts/Montserrat-Light.ttf"
  ],
  "installation": {
    "base_command": "npx moatt install video-production",
    "supports": [
      "claude",
      "cursor",
      "codex"
    ]
  }
}
