{
  "slug": "lead-gen-devtools",
  "name": "Lead Gen DevTools",
  "description": "7-skill lead generation toolkit: discovery orchestrator, GitHub repo signals, community signals, competitor signals, event signals, hiring signal outreach, and personalized demo builder.",
  "tags": [
    "lead-generation",
    "research",
    "competitive-intel"
  ],
  "skills": [
    "lead-discovery",
    "github-repo-signals",
    "community-signals",
    "competitor-signals",
    "event-signals",
    "demo-builder"
  ],
  "registry_skills": [
    "hiring-signal-outreach"
  ],
  "shared_files": [
    ".env.example",
    "requirements.txt"
  ],
  "installation": {
    "base_command": "npx moatt install lead-gen-devtools",
    "supports": [
      "claude",
      "cursor",
      "codex"
    ]
  }
}
